{
  "$schema": "https://json-schema.org/draft/2020-12/schema",
  "$id": "https://ascendrite.com/schemas/example.schema.json",
  "title": "Code Example Schema",
  "description": "JSON schema for code examples in the Ascendrite platform.",
  "type": "object",
  "required": [
    "topic_id",
    "asset_id",
    "title",
    "language",
    "code"
  ],
  "properties": {
    "topic_id": {
      "type": "string",
      "pattern": "^[a-z0-9-]+$"
    },
    "asset_id": {
      "type": "string",
      "pattern": "^[a-z0-9-]+-ex\\d+$"
    },
    "title": {
      "type": "string"
    },
    "language": {
      "type": "string"
    },
    "code": {
      "type": "string"
    }
  },
  "additionalProperties": false
}
