{
  "topic_id": "nlp-m2-t3",
  "asset_id": "nlp-m2-t3-prac1",
  "title": "Vector Similarity Metrics",
  "language": "python",
  "code": "import numpy as np\n\ndef run_practice():\n    u = np.array([1, 1, 0])\n    v = np.array([0, 1, 1])\n    sim = np.dot(u, v) / (np.linalg.norm(u) * np.linalg.norm(v))\n    assert np.allclose(sim, 0.5)\n    print('[PASS] Cosine calculation matches expectation.')\n\nif __name__ == '__main__':\n    run_practice()\n"
}