{
  "topic_id": "ai-agents-m5-t3",
  "asset_id": "ai-agents-m5-t3-ex1",
  "title": "Agent Evaluation Frameworks",
  "language": "python",
  "code": "def calculate_trajectory_efficiency(n_steps, min_steps=3):\n    # Ratio of optimal steps to actual steps\n    return min_steps / n_steps if n_steps > 0 else 0.0\n\nif __name__ == '__main__':\n    print('Trajectory metrics loaded.')\n"
}