{
  "topic_id": "deep-learning-m2-t1",
  "asset_id": "deep-learning-m2-t1-ex1",
  "title": "Optimization Algorithms",
  "language": "python",
  "code": "import numpy as np\n\n\ndef loss_and_grad(theta: np.ndarray) -> tuple[float, np.ndarray]:\n    \"\"\"Computes the loss and gradient for an anisotropic quadratic valley.\n\n    f(x, y) = 0.5 * x^2 + 10 * y^2\n    This surface has high curvature along y and low curvature along x.\n    \"\"\"\n    x, y = theta[0, 0], theta[1, 0]\n    loss = 0.5 * (x**2) + 10.0 * (y**2)\n    grad = np.array([[x], [20.0 * y]])\n    return loss, grad\n\n\ndef run_sgd(\n    init_theta: np.ndarray, lr: float, steps: int\n) -> list[tuple[float, float]]:\n    theta = init_theta.copy()\n    history = []\n    for _ in range(steps):\n        loss, grad = loss_and_grad(theta)\n        history.append((theta[0, 0], theta[1, 0]))\n        theta = theta - lr * grad\n    return history\n\n\ndef run_momentum(\n    init_theta: np.ndarray, lr: float, beta: float, steps: int\n) -> list[tuple[float, float]]:\n    theta = init_theta.copy()\n    v = np.zeros_like(theta)\n    history = []\n    for _ in range(steps):\n        loss, grad = loss_and_grad(theta)\n        history.append((theta[0, 0], theta[1, 0]))\n        v = beta * v + lr * grad\n        theta = theta - v\n    return history\n\n\ndef run_nesterov(\n    init_theta: np.ndarray, lr: float, beta: float, steps: int\n) -> list[tuple[float, float]]:\n    theta = init_theta.copy()\n    v = np.zeros_like(theta)\n    history = []\n    for _ in range(steps):\n        # Nesterov gradient evaluation at look-ahead point (theta - beta * v)\n        look_ahead = theta - beta * v\n        loss, grad = loss_and_grad(look_ahead)\n        history.append((theta[0, 0], theta[1, 0]))\n        v = beta * v + lr * grad\n        theta = theta - v\n    return history\n\n\nif __name__ == \"__main__\":\n    print(\"--- Optimizer Comparison on Anisotropic Valley ---\")\n\n    # Start at a point far from the optimum (0, 0)\n    init_pos = np.array([[10.0], [1.0]])\n    steps = 30\n    lr = 0.04  # Stable learning rate under anisotropic curvature\n    beta = 0.6\n\n    # 1. Run standard SGD\n    sgd_path = run_sgd(init_pos, lr, steps)\n    print(\"\\nSGD Path (first 5 steps):\")\n    for i, p in enumerate(sgd_path[:5]):\n        print(f\"  Step {i}: x = {p[0]:.4f}, y = {p[1]:.4f}\")\n\n    # 2. Run Momentum SGD\n    momentum_path = run_momentum(init_pos, lr, beta, steps)\n    print(\"\\nClassical Momentum Path (first 5 steps):\")\n    for i, p in enumerate(momentum_path[:5]):\n        print(f\"  Step {i}: x = {p[0]:.4f}, y = {p[1]:.4f}\")\n\n    # 3. Run Nesterov Accelerated Gradient\n    nesterov_path = run_nesterov(init_pos, lr, beta, steps)\n    print(\"\\nNesterov Momentum Path (first 5 steps):\")\n    for i, p in enumerate(nesterov_path[:5]):\n        print(f\"  Step {i}: x = {p[0]:.4f}, y = {p[1]:.4f}\")\n\n    # Metric comparison: check distance to minimum (0, 0) at the end of runs\n    final_sgd_dist = np.linalg.norm(np.array(sgd_path[-1]))\n    final_momentum_dist = np.linalg.norm(np.array(momentum_path[-1]))\n    final_nesterov_dist = np.linalg.norm(np.array(nesterov_path[-1]))\n\n    print(f\"\\nFinal Euclidean Distance to Optimum after {steps} steps:\")\n    print(f\"  Standard SGD:        {final_sgd_dist:.6f}\")\n    print(f\"  Classical Momentum:  {final_momentum_dist:.6f}\")\n    print(f\"  Nesterov Momentum:   {final_nesterov_dist:.6f}\")\n\n    # Momentum should damp oscillations and progress much closer to 0 than standard SGD\n    assert (\n        final_momentum_dist < final_sgd_dist\n    ), \"Momentum should outperform standard SGD!\"\n    assert (\n        final_nesterov_dist < final_sgd_dist\n    ), \"Nesterov should outperform standard SGD!\"\n\n    print(\"\\n  [PASS] Momentum-based optimizers damp oscillations and accelerate convergence.\")\n"
}