{
  "topic_id": "machine-learning-m4-t4",
  "asset_id": "machine-learning-m4-t4-ex1",
  "title": "Bagging & Random Forests",
  "language": "python",
  "code": "import numpy as np\n\n\nclass RidgeRegressor:\n    \"\"\"Simple Ridge Regression helper for Bagging ensemble.\"\"\"\n\n    def __init__(self, alpha: float = 1.0):\n        self.alpha = alpha\n        self.weights = None\n\n    def fit(self, X: np.ndarray, y: np.ndarray):\n        n_samples, n_features = X.shape\n        X_bias = np.hstack([np.ones((n_samples, 1)), X])\n        I = np.eye(n_features + 1)\n        I[0, 0] = 0.0\n        self.weights = np.linalg.solve(X_bias.T @ X_bias + self.alpha * I, X_bias.T @ y)\n\n    def predict(self, X: np.ndarray) -> np.ndarray:\n        n_samples = X.shape[0]\n        X_bias = np.hstack([np.ones((n_samples, 1)), X])\n        return X_bias @ self.weights\n\n\nclass BaggedRidgeRegressor:\n    \"\"\"Bagged Ridge Regression ensemble with Out-of-Bag (OOB) error tracking.\"\"\"\n\n    def __init__(self, n_estimators: int = 100, alpha: float = 1.0):\n        self.n_estimators = n_estimators\n        self.alpha = alpha\n        self.estimators = []\n        self.oob_mse = None\n\n    def fit(self, X: np.ndarray, y: np.ndarray):\n        n_samples, n_features = X.shape\n        self.estimators = []\n\n        # Track which samples were out-of-bag for each estimator\n        # oob_predictions shape: (n_samples, n_estimators), initialized to NaN\n        oob_predictions = np.full((n_samples, self.n_estimators), np.nan)\n\n        for b in range(self.n_estimators):\n            # 1. Generate bootstrap indices (with replacement)\n            bootstrap_idx = np.random.choice(n_samples, size=n_samples, replace=True)\n\n            # Identify OOB indices\n            in_bag_mask = np.zeros(n_samples, dtype=bool)\n            in_bag_mask[bootstrap_idx] = True\n            oob_idx = np.where(~in_bag_mask)[0]\n\n            # 2. Fit estimator on bootstrap sample\n            X_b = X[bootstrap_idx]\n            y_b = y[bootstrap_idx]\n\n            model = RidgeRegressor(alpha=self.alpha)\n            model.fit(X_b, y_b)\n            self.estimators.append(model)\n\n            # 3. Predict on OOB samples for this estimator\n            if len(oob_idx) > 0:\n                oob_preds = model.predict(X[oob_idx])\n                oob_predictions[oob_idx, b] = oob_preds\n\n        # 4. Calculate OOB Error\n        # For each sample, average OOB predictions from estimators that did not train on it\n        final_oob_preds = np.zeros(n_samples)\n        valid_oob_count = 0\n        squared_errors = []\n\n        for i in range(n_samples):\n            # Get predictions for sample i where estimator b did not train on it (not NaN)\n            sample_oob_preds = oob_predictions[i, ~np.isnan(oob_predictions[i])]\n            if len(sample_oob_preds) > 0:\n                final_oob_preds[i] = np.mean(sample_oob_preds)\n                squared_errors.append((y[i] - final_oob_preds[i]) ** 2)\n                valid_oob_count += 1\n\n        self.oob_mse = float(np.mean(squared_errors)) if len(squared_errors) > 0 else None\n\n    def predict(self, X: np.ndarray) -> np.ndarray:\n        \"\"\"Averages predictions from all estimators in the ensemble.\"\"\"\n        predictions = np.zeros((X.shape[0], self.n_estimators))\n        for b, model in enumerate(self.estimators):\n            predictions[:, b] = model.predict(X)\n        return np.mean(predictions, axis=1)\n\n\nif __name__ == \"__main__\":\n    # Generate synthetic regression dataset\n    np.random.seed(42)\n    n_samples = 150\n    n_features = 8\n    X_data = np.random.randn(n_samples, n_features)\n    true_w = np.array([2.0, -1.0, 0.5, 0.0, 0.0, 1.5, -2.5, 0.0])\n    y_data = X_data @ true_w + np.random.normal(0, 1.0, n_samples)\n\n    # Fit ensemble model\n    bagged_model = BaggedRidgeRegressor(n_estimators=100, alpha=1.0)\n    bagged_model.fit(X_data, y_data)\n\n    print(\"Bagged Ridge Regressor (Pure NumPy):\")\n    print(f\"Number of Estimators: {bagged_model.n_estimators}\")\n    print(f\"Out-of-Bag (OOB) MSE:  {bagged_model.oob_mse:.5f}\")\n\n    # Verify single Ridge regressor vs bagged Ridge regressor on training data\n    single_model = RidgeRegressor(alpha=1.0)\n    single_model.fit(X_data, y_data)\n    single_train_mse = np.mean((y_data - single_model.predict(X_data)) ** 2)\n    bagged_train_mse = np.mean((y_data - bagged_model.predict(X_data)) ** 2)\n\n    print(f\"Single Ridge Train MSE: {single_train_mse:.5f}\")\n    print(f\"Bagged Ridge Train MSE: {bagged_train_mse:.5f}\")\n"
}