{
  "topic_id": "deep-learning-m1-t5",
  "asset_id": "deep-learning-m1-t5-prac1",
  "title": "Deep Learning Frameworks",
  "language": "python",
  "code": "import numpy as np\n\n\nclass Var:\n    \"\"\"A variable node in the computational graph, holding data and gradients.\"\"\"\n\n    def __init__(self, data, requires_grad=False, creator=None):\n        self.data = np.asarray(data, dtype=float)\n        self.requires_grad = requires_grad\n        self.creator = creator\n        self.grad = None\n        if self.requires_grad:\n            self.grad = np.zeros_like(self.data)\n\n    def backward(self, grad=None):\n        \"\"\"Triggers backpropagation.\"\"\"\n        if not self.requires_grad:\n            return\n\n        if grad is None:\n            if self.data.size == 1:\n                grad = np.ones_like(self.data)\n            else:\n                raise RuntimeError(\"Grad must be specified for non-scalars\")\n\n        if self.grad is None:\n            self.grad = grad\n        else:\n            self.grad += grad\n\n        topo = []\n        visited = set()\n\n        def build_topo(v):\n            if v not in visited:\n                visited.add(v)\n                if v.creator is not None:\n                    for parent in v.creator.inputs:\n                        build_topo(parent)\n                    topo.append(v)\n\n        build_topo(self)\n\n        for v in reversed(topo):\n            if v.creator is None:\n                continue\n\n            inputs_grads = v.creator.backward(v.grad)\n            if not isinstance(inputs_grads, tuple):\n                inputs_grads = (inputs_grads,)\n\n            for parent, g in zip(v.creator.inputs, inputs_grads):\n                if parent.requires_grad and g is not None:\n                    if parent.grad is None:\n                        parent.grad = np.zeros_like(parent.data)\n                    parent.grad += g\n\n\nclass Function:\n    \"\"\"Base class for autograd operations.\"\"\"\n\n    @classmethod\n    def apply(cls, *args):\n        inputs = []\n        for arg in args:\n            if not isinstance(arg, Var):\n                inputs.append(Var(arg))\n            else:\n                inputs.append(arg)\n\n        ctx = cls()\n        ctx.inputs = inputs\n\n        raw_inputs = [i.data for i in inputs]\n        out_data = ctx.forward(*raw_inputs)\n\n        requires_grad = any(i.requires_grad for i in inputs)\n        out = Var(out_data, requires_grad=requires_grad, creator=ctx)\n        return out\n\n\nclass CustomSigmoid(Function):\n    \"\"\"Practice task: Implement a numerically stable custom Sigmoid autograd operator.\n\n    Includes clipping inputs to avoid overflow errors.\n    \"\"\"\n\n    def forward(self, x):\n        \"\"\"Computes the forward pass.\n\n        Saves output in context for the backward pass.\n        \"\"\"\n        # Save input x to context\n        self.x = x\n\n        # Compute sigmoid using numerically stable formula\n        # Clip inputs to prevent float overflow under exponentiation\n        x_clipped = np.clip(self.x, -500, 500)\n        self.out = 1.0 / (1.0 + np.exp(-x_clipped))\n        return self.out\n\n    def backward(self, grad_output):\n        \"\"\"Computes the backward pass vector-Jacobian product.\n\n        dJ/dx = grad_output * sigmoid(x) * (1 - sigmoid(x))\n        \"\"\"\n        # Return dJ/dx using saved forward output self.out\n        dx = grad_output * (self.out * (1.0 - self.out))\n        return dx\n\n\nif __name__ == \"__main__\":\n    print(\"--- Running Custom Sigmoid Autograd Practice ---\")\n\n    # Initialize variable and input array\n    x_val = np.array([-1.0, 0.0, 2.0])\n    x = Var(x_val, requires_grad=True)\n\n    # Execute custom sigmoid function\n    y = CustomSigmoid.apply(x)\n    print(\"Forward output y:\", y.data)\n\n    # Expected forward output\n    expected_y = 1.0 / (1.0 + np.exp(-x_val))\n    assert np.allclose(y.data, expected_y), \"Forward pass output mismatch!\"\n\n    # Execute backward pass (simulating incoming unit gradients)\n    grad_init = np.ones_like(y.data)\n    y.backward(grad_init)\n    print(\"Backward input gradient dx:\", x.grad)\n\n    # Expected backward gradient: dy/dx = y * (1 - y)\n    expected_dx = expected_y * (1.0 - expected_y)\n    assert np.allclose(x.grad, expected_dx), \"Backward pass gradient mismatch!\"\n\n    print(\"\\n  [PASS] Custom Sigmoid Autograd checks passed successfully.\")\n"
}