{
  "topic_id": "ai-agents-m4-t3",
  "asset_id": "ai-agents-m4-t3-ex1",
  "title": "Agent Specialists & Segregation",
  "language": "python",
  "code": "def configure_specialist(role, system_prompt):\n    return {\"role\": role, \"prompt\": system_prompt}\n\nif __name__ == '__main__':\n    print('Specialist factories active.')\n"
}