{
  "topic_id": "ai-agents-m3-t5",
  "asset_id": "ai-agents-m3-t5-prac1",
  "title": "Self-Correction Loops",
  "language": "python",
  "code": "def validate_output_length(text, min_len=5):\n    return len(text) >= min_len\n\ndef run_practice():\n    assert validate_output_length('Llama model')\n    assert not validate_output_length('cat')\n    print('[PASS] Output length linter checks validated.')\n\nif __name__ == '__main__':\n    run_practice()\n"
}