{
  "topic_id": "ai-agents-m4-t1",
  "asset_id": "ai-agents-m4-t1-prac1",
  "title": "Multi-Agent Topologies",
  "language": "python",
  "code": "def route_to_agent(state):\n    task = state.get('next_task')\n    if 'code' in task:\n        return 'coder_agent'\n    return 'tester_agent'\n\ndef run_practice():\n    state = {'next_task': 'write code for search'}\n    assert route_to_agent(state) == 'coder_agent'\n    print('[PASS] Multi-agent supervisor routing verified.')\n\nif __name__ == '__main__':\n    run_practice()\n"
}