{
  "topic_id": "deep-learning-m3-t1",
  "asset_id": "deep-learning-m3-t1-ex1",
  "title": "CNN Foundations",
  "language": "python",
  "code": "import numpy as np\n\n\ndef conv2d_forward_scratch(\n    X: np.ndarray,\n    W: np.ndarray,\n    b: np.ndarray,\n    stride: int = 1,\n    padding: int = 0,\n) -> np.ndarray:\n    \"\"\"Computes the forward pass of a 2D convolutional layer from scratch.\n\n    Args:\n        X: Input tensor of shape (C_in, H_in, W_in)\n        W: Weights tensor of shape (C_out, C_in, K_H, K_W)\n        b: Bias tensor of shape (C_out, 1)\n        stride: Stride step size.\n        padding: Padding size added to all sides.\n\n    Returns:\n        np.ndarray: Output tensor of shape (C_out, H_out, W_out)\n    \"\"\"\n    C_in, H_in, W_in = X.shape\n    C_out, C_in_w, K_H, K_W = W.shape\n\n    assert C_in == C_in_w, \"Weights input channel dimension must match input!\"\n\n    # 1. Compute output dimensions\n    H_out = (H_in - K_H + 2 * padding) // stride + 1\n    W_out = (W_in - K_W + 2 * padding) // stride + 1\n\n    # 2. Apply Padding\n    # Pad only the spatial height and width dimensions (dim 1 and dim 2)\n    X_padded = np.pad(\n        X,\n        pad_width=((0, 0), (padding, padding), (padding, padding)),\n        mode=\"constant\",\n        constant_values=0.0,\n    )\n\n    # 3. Create output tensor\n    out = np.zeros((C_out, H_out, W_out))\n\n    # 4. Perform cross-correlation scanning\n    for c_o in range(C_out):\n        for h in range(H_out):\n            for w in range(W_out):\n                # Calculate slice coordinates on padded input\n                h_start = h * stride\n                h_end = h_start + K_H\n                w_start = w * stride\n                w_end = w_start + K_W\n\n                # Extract the 3D slice of input: shape (C_in, K_H, K_W)\n                X_slice = X_padded[:, h_start:h_end, w_start:w_end]\n\n                # Element-wise product and summation over all input channels\n                # plus bias\n                out[c_o, h, w] = np.sum(X_slice * W[c_o]) + b[c_o, 0]\n\n    return out\n\n\nif __name__ == \"__main__\":\n    print(\"--- 2D Convolution Forward Pass Scratch Demo ---\")\n\n    # Input: 3 channels (RGB), size 5x5\n    np.random.seed(42)\n    X = np.random.randn(3, 5, 5)\n\n    # Weights: 2 output channels, 3 input channels, kernel size 3x3\n    W = np.random.randn(2, 3, 3, 3)\n    b = np.array([[0.5], [-0.2]])\n\n    # Case 1: stride=1, padding=1\n    out_1 = conv2d_forward_scratch(X, W, b, stride=1, padding=1)\n    print(\"Output shape (stride=1, padding=1):\", out_1.shape)\n    # Expected output size: H_out = (5 - 3 + 2)/1 + 1 = 5. Output shape (2, 5, 5)\n    assert out_1.shape == (2, 5, 5)\n\n    # Case 2: stride=2, padding=0\n    out_2 = conv2d_forward_scratch(X, W, b, stride=2, padding=0)\n    print(\"Output shape (stride=2, padding=0):\", out_2.shape)\n    # Expected output size: H_out = (5 - 3 + 0)/2 + 1 = 2. Output shape (2, 2, 2)\n    assert out_2.shape == (2, 2, 2)\n\n    # Numerical verification on a tiny manual configuration\n    X_test = np.array([[[1.0, 2.0, 3.0], [4.0, 5.0, 6.0], [7.0, 8.0, 9.0]]])  # (1, 3, 3)\n    W_test = np.array([[[[1.0, 0.0], [0.0, -1.0]]]])  # (1, 1, 2, 2)\n    b_test = np.array([[0.1]])\n\n    out_test = conv2d_forward_scratch(X_test, W_test, b_test, stride=1, padding=0)\n    print(\"\\nManual Test Output:\\n\", out_test)\n    # Calculations:\n    # H_out = 3 - 2 + 1 = 2\n    # Slide 0,0: [[1, 2], [4, 5]] * [[1, 0], [0, -1]] + 0.1 = 1*1 + 5*-1 + 0.1 = -3.9\n    # Slide 0,1: [[2, 3], [5, 6]] * [[1, 0], [0, -1]] + 0.1 = 2*1 + 6*-1 + 0.1 = -3.9\n    # Slide 1,0: [[4, 5], [7, 8]] * [[1, 0], [0, -1]] + 0.1 = 4*1 + 8*-1 + 0.1 = -3.9\n    # Slide 1,1: [[5, 6], [8, 9]] * [[1, 0], [0, -1]] + 0.1 = 5*1 + 9*-1 + 0.1 = -3.9\n\n    expected_out = np.array([[[-3.9, -3.9], [-3.9, -3.9]]])\n    assert np.allclose(out_test, expected_out)\n\n    print(\"\\n  [PASS] 2D convolution forward shapes and outputs verified.\")\n"
}